{
  "assertion_id": "dba-001",
  "issuer": "OrgA.GovernanceService",
  "subject_id": "req-1001",
  "subject_type": "request",
  "data_classes": ["customer_content", "confidential"],
  "permitted_operations": ["infer", "audit_export"],
  "boundary_constraints": {
    "allowed_regions": ["EU"],
    "max_retention_hours": 24,
    "redaction_required": ["customer_email"],
    "egress_allowed": false
  },
  "audit_required": true
}
